[
  {
    "schemaVersion":"chimpmaera.knowledge/envelope/v1","taxonomy":{"taxonomyId":"cm-taxonomy:universal","generation":2,"taxonomyDigest":"b517aedc9b41c2c56b903f4a8bbcb092cb48254602f54900515db1417945405c"},"scope":{"namespace":"synthetic:apple-tree","audience":"PUBLIC_SYNTHETIC"},"freshness":{"assessedAtMs":1000,"staleAfterMs":100000},"sensitivity":"PUBLIC","authority":{"credentials":[],"policyApprovals":[],"capabilities":[],"toolAccess":[],"writeTargets":[],"executionRoutes":[]},"authorityBoundary":"READ_ONLY_KNOWLEDGE_NO_CREDENTIAL_POLICY_CAPABILITY_TOOL_WRITE_OR_EXECUTION_AUTHORITY","envelopeId":"knowledge:apple-pruning","kind":"PROCEDURE","statement":"Synthetic apple-tree fixture: prune only after an owner-approved horticultural review.","attribution":[{"sourceId":"source:synthetic-handbook","citation":"Synthetic Orchard Handbook, fixture section 1.","sourceDigest":"1111111111111111111111111111111111111111111111111111111111111111","observedAtMs":900,"licence":"CC0-1.0"}],"epistemicStatus":"VERIFIED","trust":"HIGH","permittedUses":["CURATED_READ","EXPLORATORY_READ","KNOWLEDGE_GENERATION_CANDIDATE"],"conflictsWith":[],"derivedFrom":[],"generationCandidate":"ACCEPTED","envelopeDigest":"baaf09afc0171172d3af0646273b6a0247b8c8bbd8be83b24fe72939e569385a"
  },
  {
    "schemaVersion":"chimpmaera.knowledge/envelope/v1","taxonomy":{"taxonomyId":"cm-taxonomy:universal","generation":2,"taxonomyDigest":"b517aedc9b41c2c56b903f4a8bbcb092cb48254602f54900515db1417945405c"},"scope":{"namespace":"synthetic:apple-tree","audience":"PUBLIC_SYNTHETIC"},"freshness":{"assessedAtMs":1000,"staleAfterMs":100000},"sensitivity":"PUBLIC","authority":{"credentials":[],"policyApprovals":[],"capabilities":[],"toolAccess":[],"writeTargets":[],"executionRoutes":[]},"authorityBoundary":"READ_ONLY_KNOWLEDGE_NO_CREDENTIAL_POLICY_CAPABILITY_TOOL_WRITE_OR_EXECUTION_AUTHORITY","envelopeId":"knowledge:apple-sweetness","kind":"CLAIM","statement":"Synthetic unresolved claim: every apple from this fixture tree tastes sweet.","attribution":[{"sourceId":"source:synthetic-note","citation":"Anonymous synthetic orchard note, fixture line 7; not independently verified.","sourceDigest":"2222222222222222222222222222222222222222222222222222222222222222","observedAtMs":950,"licence":"CC0-1.0"}],"epistemicStatus":"UNVERIFIED","trust":"LOW","permittedUses":["EXPLORATORY_READ"],"conflictsWith":[],"derivedFrom":[],"generationCandidate":"NOT_CANDIDATE","envelopeDigest":"0f0ad9dfedec325b47f89ffddbe4cb780649b464f13039ae687d9a115c476580"
  },
  {
    "schemaVersion":"chimpmaera.knowledge/envelope/v1","taxonomy":{"taxonomyId":"cm-taxonomy:universal","generation":2,"taxonomyDigest":"b517aedc9b41c2c56b903f4a8bbcb092cb48254602f54900515db1417945405c"},"scope":{"namespace":"synthetic:apple-tree","audience":"PUBLIC_SYNTHETIC"},"freshness":{"assessedAtMs":1000,"staleAfterMs":100000},"sensitivity":"PUBLIC","authority":{"credentials":[],"policyApprovals":[],"capabilities":[],"toolAccess":[],"writeTargets":[],"executionRoutes":[]},"authorityBoundary":"READ_ONLY_KNOWLEDGE_NO_CREDENTIAL_POLICY_CAPABILITY_TOOL_WRITE_OR_EXECUTION_AUTHORITY","envelopeId":"knowledge:apple-fruit-year-two","kind":"CLAIM","statement":"Synthetic source A claims this apple tree fruits in year two.","attribution":[{"sourceId":"source:synthetic-a","citation":"Synthetic nursery card A, fixture claim A.","sourceDigest":"3333333333333333333333333333333333333333333333333333333333333333","observedAtMs":910,"licence":"CC-BY-4.0"}],"epistemicStatus":"DISPUTED","trust":"MEDIUM","permittedUses":["EXPLORATORY_READ","KNOWLEDGE_GENERATION_CANDIDATE"],"conflictsWith":["knowledge:apple-fruit-year-five"],"derivedFrom":[],"generationCandidate":"ACCEPTED","envelopeDigest":"59a5a778654019809cbb8ec6ff69983430e20b551ba719fcd6f831374127b54c"
  },
  {
    "schemaVersion":"chimpmaera.knowledge/envelope/v1","taxonomy":{"taxonomyId":"cm-taxonomy:universal","generation":2,"taxonomyDigest":"b517aedc9b41c2c56b903f4a8bbcb092cb48254602f54900515db1417945405c"},"scope":{"namespace":"synthetic:apple-tree","audience":"PUBLIC_SYNTHETIC"},"freshness":{"assessedAtMs":1000,"staleAfterMs":100000},"sensitivity":"PUBLIC","authority":{"credentials":[],"policyApprovals":[],"capabilities":[],"toolAccess":[],"writeTargets":[],"executionRoutes":[]},"authorityBoundary":"READ_ONLY_KNOWLEDGE_NO_CREDENTIAL_POLICY_CAPABILITY_TOOL_WRITE_OR_EXECUTION_AUTHORITY","envelopeId":"knowledge:apple-fruit-year-five","kind":"CLAIM","statement":"Synthetic source B claims this apple tree does not fruit before year five.","attribution":[{"sourceId":"source:synthetic-b","citation":"Synthetic nursery card B, fixture claim B.","sourceDigest":"4444444444444444444444444444444444444444444444444444444444444444","observedAtMs":920,"licence":"CC-BY-4.0"}],"epistemicStatus":"DISPUTED","trust":"MEDIUM","permittedUses":["EXPLORATORY_READ","KNOWLEDGE_GENERATION_CANDIDATE"],"conflictsWith":["knowledge:apple-fruit-year-two"],"derivedFrom":[],"generationCandidate":"ACCEPTED","envelopeDigest":"6c8828ed218d53b86ccb2e158088244591669ff52b16bfeedb50b4a931dcac9f"
  }
]
